id,color,bizName,email,description,addr1,addr2,city,state,zip,urlPM,urlSite,urlBlog,urlFb,urlTwtr,urlLi,urlYt,bizType,newsletter,site-agree,franchise,featured,featured-start,featured-end,dateCreated,dateExpires,status
74,8,Out of the Closet Artwear,scubameat@earthlink.net,Hand dyed clothing with a twist!<br />,1907 SE 39th Ave,,Portland,OR,972147214,OutoftheClosetArtwear,http://www.outoftheclosetartwear.biz,,,,,,vendor,0,1,0,0,,,9/15/2010 8:24,9/15/2011 8:24,active
65,5,Oregon Soap Company,shipping@oregonsoapcompany.com,Manufacturer of long lasting great smelling certified organic bar and liquid soaps.<br />,P.O. Box 14464,,Portland ,OR,972937293,OregonSoapCompany,http://www.oregonsoapcompany.com,http://https://www.oregonsoapcompany.com/soapmans-blog,http://www.facebook.com/pages/Oregon-Soap-Company/111497225564458?ref=ts,http://twitter.com/oregonsoap,,http://www.youtube.com/user/OregonSoapCompany,vendor,0,1,0,1,6/1/2010 12:20,12/31/2010 17:00,9/9/2010 15:59,9/9/2011 15:59,active
64,8,OneMark Creations,dmessina@onemarkcreations.com,OneMark Creations - Your source for original tea coffee and kitchen accessories including cozies tea wallets and appliance covers.<br />,PO Box 3,,Beaverton,OR,970757075,OneMarkCreations,http://www.onemarkcreations.com,,,,,,vendor,0,1,0,1,6/1/2010 12:20,12/31/2010 17:00,9/2/2010 16:21,9/2/2011 16:21,active
56,5,Rebicyclist,email@rebicyclist.com,Art and Accessories from recycled bike parts.<br />,14453 E Burnside St Apt 102,,Portland,OR,972337233,Rebicyclist,http://www.rebicyclist.com,,http://www.facebook.com/pages/Rebicyclist/341266672597,,,,vendor,0,1,0,1,6/1/2010 12:20,12/31/2010 17:00,8/19/2010 17:43,8/19/2011 17:43,active
55,4,Cretin,brian@cretinart.com,All original artwork by Brian and Erika Doogan. Images are hand drawnpainted and printed by the artists. Thank you,P.O. Box 1612,,Clatskanie,OR,970167016,Cretin,http://www.cretinart.com,,,,,,vendor,0,1,0,1,6/1/2010 12:20,12/31/2010 17:00,8/17/2010 17:36,8/17/2011 17:36,active
41,5,Eastside Longboards,robskey@gmail.com,,PLEASE UPDATE ADDRESS,,,,,EastsideLongboards,,,,,,,vendor,0,1,0,1,6/1/2010 12:20,12/31/2010 17:00,6/29/2010 23:37,6/29/2011 23:37,active
29,1,Lolly-tots,mk_safire@yahoo.com,Funky hats for funky people!&nbsp; Very silly animal and monster hats for kids of all ages.&nbsp; ,646 SE 60th ave #H,,Portland,OR,972157215,lollytots,http://www.etsy.com/shop/lollytots,,http://www.facebook.com/pages/Portland-OR/Lolly-tots/176872772053?ref=sgm&__a=4&,http://twitter.com/lollytotsPDX,,http://www.youtube.com/user/lollytotskids,vendor,0,1,0,1,6/1/2010 12:20,12/31/2010 17:00,6/23/2010 8:35,6/23/2011 8:35,active
